{
  "schema_id": "gait.pack.run",
  "schema_version": "1.0.0",
  "created_at": "2026-02-14T00:00:00Z",
  "run_id": "run_demo",
  "capture_mode": "reference",
  "manifest_digest": "3333333333333333333333333333333333333333333333333333333333333333",
  "intents_count": 1,
  "results_count": 1,
  "refs_count": 1
}
